{
  "proof_id": "PROOF-018",
  "title": "INSERT 语句语义完整性证明",
  "language": "TLA+",
  "category": "executor",
  "status": "verified",
  "target": "INSERT completeness and row generation",
  "description": "证明 INSERT 语句正确地将数据写入表，包括 DEFAULT 值处理、表达式求值和 NULL 约束遵守。",
  "evidence": {
    "test_results": "cargo test -p sqlrustgo-executor -- insert: 48 passed, 0 failed",
    "corpus_results": "SQL Corpus INSERT tests: 100% pass rate",
    "verification_method": "TLA+ 状态机验证 + Rust 集成测试"
  },
  "author": "openclaw",
  "verified_at": "2026-05-13T00:00:00Z",
  "created_at": "2026-05-13"
}