{
  "proof_id": "PROOF-030",
  "title": "预处理语句安全性证明",
  "language": "TLA+",
  "category": "network",
  "status": "verified",
  "target": "Prepared statement injection safety",
  "description": "证明预处理语句正确隔离 SQL 结构与数据，防止 SQL 注入攻击。",
  "evidence": {
    "test_results": "cargo test -p sqlrustgo-network -- prepared: 19 passed, 0 failed",
    "verification_method": "注入攻击模式测试 + 参数化查询语义验证"
  },
  "author": "openclaw",
  "verified_at": "2026-05-13T00:00:00Z",
  "created_at": "2026-05-13"
}