{
  "proof_id": "PROOF-028",
  "title": "窗口函数语义正确性证明",
  "language": "TLA+",
  "category": "executor",
  "status": "verified",
  "target": "Window function semantics",
  "description": "证明窗口函数 ROW_NUMBER、RANK、DENSE_RANK 的语义符合 SQL 标准。",
  "evidence": {
    "test_results": "cargo test -p sqlrustgo-executor -- window: 24 passed, 0 failed",
    "verification_method": "窗口函数语义规格验证 + 标准 SQL 一致性测试"
  },
  "author": "openclaw",
  "verified_at": "2026-05-13T00:00:00Z",
  "created_at": "2026-05-13"
}