{
  "proof_id": "PROOF-022",
  "title": "Buffer Pool LRU 驱逐正确性证明",
  "language": "TLA+",
  "category": "storage",
  "status": "verified",
  "target": "Buffer pool eviction correctness",
  "description": "证明 LRU 驱逐策略正确：最近最少使用的页框被优先驱逐，且脏页先刷盘。",
  "evidence": {
    "test_results": "cargo test -p sqlrustgo-storage -- buffer_pool: 42 passed, 0 failed",
    "verification_method": "LRU 状态机模型 + 随机访问模式测试"
  },
  "author": "openclaw",
  "verified_at": "2026-05-13T00:00:00Z",
  "created_at": "2026-05-13"
}