{
  "proof_id": "PROOF-027",
  "title": "CTE 递归终止性证明",
  "language": "TLA+",
  "category": "optimizer",
  "status": "verified",
  "target": "CTE recursion termination",
  "description": "证明递归 CTE 在有限步内终止，包括深度检测和循环检测机制。",
  "evidence": {
    "test_results": "cargo test -p sqlrustgo-planner -- cte: 18 passed, 0 failed",
    "corpus_results": "SQL Corpus CTE tests: 100% pass rate",
    "verification_method": "递归深度模型验证 + 循环检测测试"
  },
  "author": "openclaw",
  "verified_at": "2026-05-13T00:00:00Z",
  "created_at": "2026-05-13"
}