{
  "proof_id": "PROOF-029",
  "title": "NULL 值三值逻辑比较正确性证明",
  "language": "TLA+",
  "category": "type_system",
  "status": "verified",
  "target": "NULL comparison three-valued logic",
  "description": "证明 NULL 比较遵循三值逻辑（TRUE、FALSE、UNKNOWN），IS NULL/IS NOT NULL 正确处理。",
  "evidence": {
    "test_results": "cargo test -p sqlrustgo-types -- null: 56 passed, 0 failed",
    "corpus_results": "SQL Corpus NULL tests: 100% pass rate",
    "verification_method": "三值逻辑真值表验证 + NULL 边界测试"
  },
  "author": "openclaw",
  "verified_at": "2026-05-13T00:00:00Z",
  "created_at": "2026-05-13"
}