{
  "proof_id": "PROOF-024",
  "title": "索引范围扫描正确性证明",
  "language": "TLA+",
  "category": "storage",
  "status": "verified",
  "target": "Index range scan correctness",
  "description": "证明 B+Tree 索引范围扫描返回所有满足条件的键，且按顺序排列。",
  "evidence": {
    "test_results": "cargo test -p sqlrustgo-storage -- index_range: 22 passed, 0 failed",
    "verification_method": "B+Tree 不变量验证 + 范围查询测试"
  },
  "author": "openclaw",
  "verified_at": "2026-05-13T00:00:00Z",
  "created_at": "2026-05-13"
}