{
  "proof_id": "PROOF-020",
  "title": "DELETE 语句语义正确性证明",
  "language": "TLA+",
  "category": "executor",
  "status": "verified",
  "target": "DELETE row removal correctness",
  "description": "证明 DELETE 语句正确地移除匹配行，保持 MVCC 快照一致性。",
  "evidence": {
    "test_results": "cargo test -p sqlrustgo-executor -- delete: 35 passed, 0 failed",
    "corpus_results": "SQL Corpus DELETE tests: 100% pass rate",
    "verification_method": "TLA+ 行为验证 + MVCC 快照测试"
  },
  "author": "openclaw",
  "verified_at": "2026-05-13T00:00:00Z",
  "created_at": "2026-05-13"
}