{
  "proof_id": "PROOF-023",
  "title": "死锁检测完备性证明",
  "language": "TLA+",
  "category": "transaction",
  "status": "verified",
  "target": "Deadlock detection completeness",
  "description": "证明死锁检测算法能发现所有可能的死锁情况，包括换向死锁和长事务链死锁。",
  "evidence": {
    "test_results": "cargo test -p sqlrustgo-transaction -- deadlock: 15 passed, 0 failed",
    "verification_method": "TLA+ 死锁检测器验证 + 模拟死锁场景测试"
  },
  "author": "openclaw",
  "verified_at": "2026-05-13T00:00:00Z",
  "created_at": "2026-05-13"
}